{"$schema":"https://ui.logic2b.com/schema/registry-versions.json","schemaVersion":1,"latest":"1.0.0-rc.17","channels":{"next":"1.0.0-rc.17"},"versions":[{"version":"1.0.0-rc.17","channel":"next","releasedAt":"2026-10-03","manifest":"/r/versions/1.0.0-rc.17.json"},{"version":"1.0.0-rc.16","channel":"next","releasedAt":"2026-08-30","manifest":"/r/versions/1.0.0-rc.16.json"},{"version":"1.0.0-rc.15","channel":"next","releasedAt":"2026-08-30","manifest":"/r/versions/1.0.0-rc.15.json"},{"version":"1.0.0-rc.14","channel":"next","releasedAt":"2026-08-30","manifest":"/r/versions/1.0.0-rc.14.json"},{"version":"1.0.0-rc.13","channel":"next","releasedAt":"2026-08-30","manifest":"/r/versions/1.0.0-rc.13.json"},{"version":"1.0.0-rc.12","channel":"next","releasedAt":"2026-08-30","manifest":"/r/versions/1.0.0-rc.12.json"},{"version":"1.0.0-rc.11","channel":"next","releasedAt":"2026-08-30","manifest":"/r/versions/1.0.0-rc.11.json"},{"version":"1.0.0-rc.10","channel":"next","releasedAt":"2026-08-30","manifest":"/r/versions/1.0.0-rc.10.json"},{"version":"1.0.0-rc.9","channel":"next","releasedAt":"2026-08-30","manifest":"/r/versions/1.0.0-rc.9.json"},{"version":"1.0.0-rc.8","channel":"next","releasedAt":"2026-08-29","manifest":"/r/versions/1.0.0-rc.8.json"},{"version":"1.0.0-rc.7","channel":"next","releasedAt":"2026-08-29","manifest":"/r/versions/1.0.0-rc.7.json"},{"version":"1.0.0-rc.6","channel":"next","releasedAt":"2026-08-29","manifest":"/r/versions/1.0.0-rc.6.json"},{"version":"1.0.0-rc.5","channel":"next","releasedAt":"2026-08-29","manifest":"/r/versions/1.0.0-rc.5.json"},{"version":"1.0.0-rc.4","channel":"next","releasedAt":"2026-08-29","manifest":"/r/versions/1.0.0-rc.4.json"},{"version":"1.0.0-rc.3","channel":"next","releasedAt":"2026-08-29","manifest":"/r/versions/1.0.0-rc.3.json"},{"version":"1.0.0-rc.2","channel":"next","releasedAt":"2026-08-29","manifest":"/r/versions/1.0.0-rc.2.json"},{"version":"1.0.0-rc.1","channel":"next","releasedAt":"2026-08-29","manifest":"/r/versions/1.0.0-rc.1.json"}]}